userId,courseId,rating,difficulty,comments,interactive
94,1,3,Medium,Like interview test number degree price share marriage.,No
33,179,1,Easy,Against stay eat step song total.,Yes
83,159,5,Hard,Student pass call those.,Yes
110,230,2,Easy,Check letter enter you after floor.,No
39,96,2,Hard,Lawyer music chair point.,Yes
44,126,1,Hard,Technology water day Democrat main perform truth another.,No
5,273,1,Hard,Bar situation interest forward blood.,Yes
80,21,2,Medium,Value never paper once must citizen anyone.,Yes
167,45,5,Easy,Whether federal single finally.,Yes
106,46,2,Hard,Rise cup return should continue opportunity last really.,Yes
13,92,2,Easy,Painting feel them security lay police significant national.,Yes
133,220,5,Hard,Lawyer official say try.,Yes
30,279,3,Hard,Capital quality term reduce blood large their.,Yes
188,253,1,Medium,Sometimes six through forward.,No
194,110,3,Medium,Politics summer later edge under.,Yes
13,138,5,Hard,Common industry lead manage its page amount.,No
68,216,2,Medium,Next culture why forget want deal figure.,No
119,75,4,Medium,Chair push water film site.,Yes
118,253,1,Hard,Foot glass late meeting herself book image.,Yes
61,29,3,Hard,Next life none certainly set.,No
4,116,3,Easy,Personal discover various forget home section.,No
125,262,2,Easy,Tax TV too eye central but though.,Yes
6,203,4,Easy,Computer Congress character deep look sense.,Yes
41,223,1,Medium,Future to serious wait area.,Yes
43,69,4,Easy,Difficult adult fire of season me program.,No
124,299,2,Easy,I strong heavy so.,Yes
53,243,4,Easy,Couple build brother until discuss.,No
92,113,2,Hard,Face doctor else natural policy term show experience.,Yes
145,45,4,Hard,Serious civil have.,Yes
85,57,3,Easy,Human politics sign concern.,No
78,191,1,Medium,War interest heavy scene again.,No
161,181,2,Hard,Address no personal.,No
9,44,1,Hard,Remain it glass about page song.,Yes
29,70,1,Easy,She surface yes white.,Yes
29,275,5,Medium,Who population baby mind.,Yes
52,281,4,Medium,Less agency fill girl child.,Yes
7,168,3,Medium,Someone develop pattern ahead boy.,Yes
126,5,5,Medium,City item risk watch build simple check skin.,Yes
25,55,4,Easy,Yes style they hospital management.,No
27,99,2,Easy,Name everything how whether girl.,Yes
61,70,4,Easy,Street any movie natural eat police.,Yes
134,39,4,Easy,Conference responsibility fight such matter.,Yes
34,165,3,Hard,Star analysis five part get base.,No
153,163,1,Easy,Let movement defense face push.,No
29,201,2,Hard,Condition easy particularly realize billion treat.,No
107,154,5,Hard,School five break.,Yes
193,267,1,Hard,Alone sister grow charge home.,No
52,79,1,Medium,Pm yourself bar town standard.,No
79,201,4,Hard,Kind if ago participant himself should energy and.,No
109,289,4,Hard,Show describe blue tax maybe imagine less.,Yes
168,257,2,Medium,Role tough control remain.,No
185,77,4,Hard,Minute job indicate full spend stage break.,Yes
